{
  "schema_version": 1,
  "kind": "ortak_kopru_donusum",
  "hazirlayan": "Claude Code Bulut (Hacker odağı)",
  "hazirlandi": "2026-10-28T16:55:00Z",
  "amac": "GitHub'daki ana dalı, ayrı bir dalda kurulan yeni oluşuma ölçülerek, sırayla ve her adımı geri alınabilir biçimde geçirmek.",
  "baslangic": {
    "ad": "GitHub'daki ana dal",
    "dal": "main",
    "surum": "97c908de7a5850978082770ba3bac3e508688e57",
    "tarih": "2026-10-28T09:25:00Z",
    "kok_dosya": 38
  },
  "hedef": {
    "ad": "Yeni oluşum",
    "dal": "claude/rafine-2026-10-28",
    "oneri": 23,
    "gecmis_surumleri": [
      "9ccd97b02d1e4170b3eed8ff2a3f16d6acb3d1d9",
      "2a58183b7106cf58b4b639e87b9062c60e91e43e"
    ]
  },
  "giris": [
    "Bu sayfa, Ortak Köprü deposunun 28 Ekim 2026'da bugünkü düzenine nasıl geçtiğini anlatıyor. Yeni hâl önce ayrı bir yerde kuruldu ve sınandı, sonra aşama aşama ana depoya geçti. Her aşamanın kimin elinde olduğu, nasıl anlaşıldığı ve nasıl geri alınabileceği yazılı.",
    "Bu geçiş, açılıştan gerçeğe giden [yolun](../yol.md) ilk adımını ana depoda gerçek kıldı. Komutlar ve ölçütler [dönüşümün teknik ekinde](donusum-teknik.md) duruyor. Teknik konuların hepsi [teknik ayrıntılar](../teknik/README.md), bugüne kadar yapılanlar [geçmiş işler](README.md) bölümünde."
  ],
  "degisenler": [
    "Okuyan biri için değişen şey düzendir. Deponun girişi açılışla başlıyor. Dosyalar adı söylenen alanlara ayrıldı: ortak defterin araçları, katılımcıların ayarları, yerel bilgisayarın araçları ve belgeler. Teknik ayrıntılar ile geçmiş işler ayrı klasörlerde duruyor.",
    "Kök klasör sadeleşti. Her dosyanın yeri, eski adı ve ne işe yaradığı bir haritada duruyor; her alanın klasöründe de bir giriş sayfası var. Eski kayıtlarda geçen bir dosya adı o haritadan bulunur. Yapay zekâ yardımcılarına verilmiş talimatlar da kaldırıldı."
  ],
  "degismeyenler": [
    "Dışarıdan adresle ulaşılan her şey yerinde kaldı. Ortak defterin Web adresi, aynası, Web sayfalarının adresleri ve çağrı kayıtları değişmedi. Web'deki asistanlar ortak defteri eskisi gibi okuyor.",
    "Bilgisayarda çift tıklanan izleyici girişi de yerinde kaldı. Araçların adları değişmedi; yalnız durdukları klasör değişti. Ortak defterdeki hiçbir kayıt değiştirilmedi."
  ],
  "yol": [
    "Aşağıdaki resim geçişi bir taşınma gibi gösteriyor. Solda 28 Ekim sabahki depo var: bütün dosyalar tek bir odada. Sağda bugünkü hâl var: her şeyin bir rafı. Kapı aynı kalıyor. Yoldaki sayılar aşamaları gösteriyor."
  ],
  "geri_donus": [
    "Geçişin en önemli aşaması olan birleştirme tek adımda geri alınabilir. GitHub'daki geri alma düğmesine basılırsa ana depo eski hâline döner. Kaldırılan talimat dosyaları da istenirse haritada yazılı önceki sürümlerinden geri getirilir.",
    "Bu sırada hiçbir kayıt silinmez; geri almanın kendisi de bir kayıttır. Daha sonra yeniden denemek için geri almanın da geri alınması gerekir."
  ],
  "okur": [
    "Bu geçişi izleyebilirsiniz. Yeni hâl ana depoda duruyor ve Web'de okunabiliyor. Bir şey sormak ya da bir sorun bildirmek isterseniz [karşılık formunu açın](https://github.com/HalukAINRS/ortak-kopru/issues/new?template=karsilik.yml); GitHub buna Issue der."
  ],
  "teknik_giris": [
    "Bu ek, GitHub'daki ana dalın yeni oluşuma geçişinin teknik karşılığıdır: aşamaların komutları, dokunduğu yerler, ölçütleri, son ölçüm ve prova, bekleyen öteki önerilerin çözümlemesi ve geri dönüş. Sade anlatım dönüşüm sayfasındadır.",
    "Kayıt `docs/gecmis/donusum.json`, sözleşmesi `schemas/donusum.schema.json`, aracı `tools/donusum.py`. Araç belgeleri kayıttaki son ölçümden üretir; `--durum` canlı durumu, `--olc --yaz` yeni ölçümü, `--prova --yaz` birleşme provasını, `--dallar --yaz` bekleyen önerilerin çözümlemesini verir."
  ],
  "cizimler": [
    {
      "kimlik": "tasinma",
      "tur": "ressam",
      "yer": "belge",
      "bolum": "yol",
      "baslik": "Taşınma",
      "metin": "      bugünkü depo                             yeni hâl\n  ┌──────────────────────┐            ┌──────┬──────┬──────┐\n  │ ▣ ▣▣ ▣  ▣▣ ▣ ▣▣ ▣ ▣▣ │            │ ▣▣   │ ▣▣▣  │ ▣▣   │\n  │ ▣▣ ▣▣ ▣ ▣ ▣▣▣ ▣ ▣  ▣ │   ┌──────┐ ├──────┼──────┼──────┤\n  │  ▣ ▣▣▣ ▣▣ ▣ ▣▣ ▣ ▣▣▣ │   │▣▣▣▣▣▣│ │ ▣▣▣  │ ▣▣   │ ▣▣▣  │\n  │ ▣▣ ▣ ▣▣ ▣▣▣ ▣ ▣▣ ▣ ▣ │ ══╡▣▣▣▣▣▣╞▶├──────┼──────┼──────┤\n  │   hepsi tek odada    │   └○────○┘ │ her şeyin bir rafı │\n  └─────────┤░░├─────────┘            └──────┤░░├──────────┘\n       kapı └┬─┘                       kapı  └┬─┘\n  ───────────┴──0──1──2──3──4──5──6──7──8──9──┴──────────────\n              aynı kapı, aynı adres; yalnız raflar değişiyor"
    },
    {
      "kimlik": "geri-donus",
      "tur": "muhendis",
      "yer": "teknik",
      "bolum": "geri-donus",
      "baslik": "Birleşme ve geri dönüş",
      "metin": "  zaman ──────────────────────────────────────────────▶\n\n  ana dal  ●─────────────●─────────────●─────────────●\n           bugün         B             G             Y\n           97c908d       ▲ birleşme    geri alma     yeniden\n                         │ yeni hâl    eski hâl      dener\n  dal   ●──●──●──●──●────┘             döner\n        yeni oluşumun sürümleri ana dalın geçmişine girer\n\n  B: birleştirme kaydı; geçmişi korur, tek adımda geri alınır\n  G: geri almanın kendisi de bir kayıttır; hiçbir şey silinmez\n  Y: yeniden denemek için önce G geri alınır"
    }
  ],
  "asamalar": [
    {
      "no": 0,
      "kimlik": "olusum",
      "ad": "Yeni oluşum hazır",
      "kim": "Claude Code Bulut",
      "zorunlu": true,
      "onkosul": [],
      "karar": null,
      "sade": {
        "ne": "Yeni oluşum ayrı bir dalda kuruldu ve GitHub'a bir değişiklik önerisi olarak sunuldu.",
        "neden": "Ana dal her saat çalışan bir otomasyonu besliyordu ve bir yerel bilgisayarı da besleyecek biçimde yazılmıştı. Bu kadar büyük bir değişiklik önce ayrı bir yerde kurulup sınanmalıydı.",
        "nasil": "Açılış, alanlar, harita, yol ve bu dönüşüm yolu o dalda duruyor. Her değişiklikte bütün denetimler iki ayrı işletim sisteminde çalışıyor.",
        "geri": "Dal ana dala dokunmaz. İstenirse öneri kapatılır ve hiçbir şey değişmez.",
        "sonra": "Yeni hâlin bütün parçaları görülebilir ve sınanabilir bir yerde durur."
      },
      "teknik": {
        "komutlar": [
          "git fetch origin claude/rafine-2026-10-28",
          "git switch claude/rafine-2026-10-28",
          "python tools/dogrula.py"
        ],
        "dokunur": [
          "claude/rafine-2026-10-28 dalı",
          "değişiklik önerisi #23"
        ],
        "geri_donus": "Öneri #23 kapatılır; dal silinmeden de kalabilir. Ana dal etkilenmez."
      },
      "olcutler": [
        {
          "tur": "dosya_var",
          "ref": "dal",
          "yol": "docs/acilis.md"
        },
        {
          "tur": "dosya_var",
          "ref": "dal",
          "yol": "docs/harita.json"
        },
        {
          "tur": "dosya_var",
          "ref": "dal",
          "yol": "docs/yol.json"
        },
        {
          "tur": "dosya_var",
          "ref": "dal",
          "yol": "docs/donusum.json"
        },
        {
          "tur": "dosya_var",
          "ref": "dal",
          "yol": "defter/kopru_ekle.py"
        }
      ]
    },
    {
      "no": 1,
      "kimlik": "prova",
      "ad": "Prova",
      "kim": "makine",
      "zorunlu": true,
      "onkosul": [
        "olusum"
      ],
      "karar": null,
      "sade": {
        "ne": "Birleşme, ana dalın bir kopyası üzerinde önceden denenir.",
        "neden": "Ana dala dokunmadan sonucu görmek için. Bir çakışma ya da kırılan bir denetim varsa birleşmeden önce ortaya çıkar.",
        "nasil": "Ana dalın geçici bir kopyası açılır ve yeni oluşum onunla birleştirilir. Bütün denetimler o kopyada çalışır. Ana daldaki her dosyanın yeni yerinde ya da eski adıyla haritada bulunduğu sınanır. Kopya sonra silinir.",
        "geri": "Prova bir kopya üzerinde yapılır; geri alınacak bir şey yoktur.",
        "sonra": "Birleşmenin sonucu önceden bilinir: çakışma var mı, denetimler geçiyor mu."
      },
      "teknik": {
        "komutlar": [
          "git fetch origin",
          "python tools/donusum.py --prova --ana origin/main --dal origin/claude/rafine-2026-10-28 --yaz"
        ],
        "dokunur": [
          "geçici bir Git çalışma ağacı (iş bitince silinir)",
          "docs/donusum.json (son_prova)"
        ],
        "geri_donus": "Geçici çalışma ağacını araç kendisi siler; kayda yalnız sonuç yazılır."
      },
      "olcutler": [
        {
          "tur": "prova_gecti"
        }
      ]
    },
    {
      "no": 2,
      "kimlik": "yerel-hazirlik",
      "ad": "Yerel hazırlık",
      "kim": "Haluk",
      "zorunlu": true,
      "onkosul": [
        "prova"
      ],
      "karar": null,
      "sade": {
        "ne": "Yerel bilgisayardaki izleyici durdurulur. Gönderilmemiş bir değişiklik varsa önce gönderilir.",
        "neden": "Dosyaların yeri değişirken yerelde yarım kalan bir değişiklik yeni yerleşimle çakışabilir. Çalışmakta olan izleyici de yeni hâli çekince eski yolları bulamaz.",
        "nasil": "İzleyicinin penceresi kapatılır. Bekleyen bir değişiklik varsa izleyicinin gönderme komutuyla gönderilir. Sonra yerel klasörde bekleyen değişiklik kalmadığı bir kez daha denetlenir.",
        "geri": "Hiçbir şey silinmez. İzleyici yeniden açılırsa eski hâliyle çalışmayı sürdürür.",
        "sonra": "Yerel bilgisayarda gönderilmemiş bir değişiklik kalmaz; yeni hâlle çakışacak bir şey yoktur."
      },
      "teknik": {
        "komutlar": [
          "Kopru_Izle.cmd penceresini kapat (sürekli izleme durur)",
          "Kopru_Izle.cmd Gonder",
          "git status --short",
          "git log --oneline origin/main..main"
        ],
        "dokunur": [
          "Y:\\HalukAI\\Ortak_Kopru\\kopru (tasarımdaki yerel çalışma kopyası; 28 Ekim 2026 itibarıyla yok)"
        ],
        "geri_donus": "Kopru_Izle.cmd yeniden çalıştırılır; eski yerleşimle sürer."
      },
      "olcutler": [
        {
          "tur": "elle",